post_id,post_type,item_name,category,color,brand,description,location,date,contact_method,true_match_id,match_group
F060,found,hoodie,clothing,red,Adidas,Found a red hoodie near State Street. Left it with email.,State Street,2026-03-30,security desk,,U_F060
F061,found,calculator,electronics,grey,Texas Instruments,Picked up a grey calculator around Wisconsin Union Theater. Message with details to confirm.,Wisconsin Union Theater,2026-03-09,security desk,,U_F061
F062,found,necklace,jewelry_accessories,gold,,Someone left a necklace at Witte Residence Hall. Looks gold. a small dent.,Witte Residence Hall,2026-04-23,campus app message,,U_F062
F063,found,earring,jewelry_accessories,gold,,Found gold earring outside Engineering Hall; turned into security desk.,Engineering Hall,2026-05-29,campus app message,,U_F063
F064,found,lunch box,miscellaneous,green,,There is a green lunch box at Humanities Building. I can meet or leave it at the desk.,Humanities Building,2026-03-01,front desk pickup,,U_F064
F065,found,textbook,books_notes,green,,Found green textbook outside Nicholas Recreation Center; turned into department office.,Nicholas Recreation Center,2026-05-08,residence hall desk,,U_F065
F066,found,jacket,clothing,dark blue,North Face,There is a dark blue jacket at Bakke Recreation Center. I can meet or leave it at the desk.,Bakke Recreation Center,2026-03-29,security desk,,U_F066
F067,found,phone,electronics,white,iPhone,Someone left a phone at Grainger Hall. Looks white. a small dent.,Grainger Hall,2026-03-04,security desk,,U_F067
F068,found,charger cable,electronics,dark,Anker,Found dark charger cable outside SERF; turned into residence hall desk.,SERF,2026-04-29,email,,U_F068
F069,found,glasses,miscellaneous,tan,,There is a tan glasses at Kohl Center. I can meet or leave it at the desk.,Kohl Center,2026-05-15,library circulation desk,,U_F069
F070,found,tote bag,bags,dark,,Found a dark tote bag near Memorial Library. Left it with campus app message.,Memorial Library,2026-03-18,department office,,U_F070
F071,found,water bottle,bottle,dark blue,Hydro Flask,Picked up a dark blue water bottle around Bascom Hall. Message with details to confirm.,Bascom Hall,2026-04-18,front desk pickup,,U_F071
F072,found,card holder,wallets_cards,tan,,Found tan card holder outside Engineering Hall; turned into front desk pickup.,Engineering Hall,2026-06-06,security desk,,U_F072
F073,found,headphones,electronics,blue,Beats,Found blue headphones outside Business School; turned into front desk pickup.,Business School,2026-04-30,campus app message,,U_F073
F074,found,scarf,clothing,pink,,There is a pink scarf at Bakke Recreation Center. I can meet or leave it at the desk.,Bakke Recreation Center,2026-03-29,residence hall desk,,U_F074
F075,found,lab notebook,books_notes,green,,Found a green lab notebook near College Library. Left it with department office.,College Library,2026-04-01,email,,U_F075
F076,found,pencil case,miscellaneous,blue,,There is a blue pencil case at Union South. I can meet or leave it at the desk.,Union South,2026-03-17,security desk,,U_F076
F077,found,bike helmet,miscellaneous,dark,,Found a dark bike helmet near Memorial Library. Left it with library circulation desk.,Memorial Library,2026-04-29,residence hall desk,,U_F077
F078,found,travel cup,bottle,pink,Stanley,Someone left a travel cup at Business School. Looks pink. a worn label.,Business School,2026-05-17,residence hall desk,,U_F078
F079,found,ID lanyard,wallets_cards,red,UW-Madison,Found a red ID lanyard near Wisconsin Union Theater. Left it with department office.,Wisconsin Union Theater,2026-04-09,campus app message,,U_F079
F080,found,tablet,electronics,dark,Samsung,Found a dark tablet near Camp Randall. Left it with front desk pickup.,Camp Randall,2026-05-26,security desk,,U_F080
F081,found,sunglasses,miscellaneous,dark,,Picked up a dark sunglasses around Sellery Residence Hall. Message with details to confirm.,Sellery Residence Hall,2026-05-28,department office,,U_F081
F082,found,winter hat,clothing,white,,Picked up a white winter hat around Lakeshore Path. Message with details to confirm.,Lakeshore Path,2026-05-27,library circulation desk,,U_F082
F083,found,folder,books_notes,blue,,There is a blue folder at Helen C. White Library. I can meet or leave it at the desk.,Helen C. White Library,2026-04-14,library circulation desk,,U_F083
F084,found,lanyard,wallets_cards,dark,,Someone left a lanyard at Witte Residence Hall. Looks dark. a zipper pocket.,Witte Residence Hall,2026-05-22,front desk pickup,,U_F084
F085,found,keyboard,electronics,dark,Logitech,Found dark keyboard outside Union South; turned into department office.,Union South,2026-03-14,security desk,,U_F085
F086,found,mouse,electronics,grey,Microsoft,Found grey mouse outside Dejope Residence Hall; turned into residence hall desk.,Dejope Residence Hall,2026-04-25,email,,U_F086
F087,found,gym bag,bags,dark,Nike,There is a dark gym bag at Bakke Recreation Center. I can meet or leave it at the desk.,Bakke Recreation Center,2026-05-18,department office,,U_F087
F088,found,water bottle,bottle,green,Nalgene,Found green water bottle outside State Street; turned into security desk.,State Street,2026-06-14,residence hall desk,,U_F088
F089,found,planner,books_notes,pink,,Someone left a planner at Camp Randall. Looks pink. a keychain attached.,Camp Randall,2026-03-12,front desk pickup,,U_F089
F090,found,bracelet,jewelry_accessories,gold,,Picked up a gold bracelet around Bascom Hall. Message with details to confirm.,Bascom Hall,2026-05-12,library circulation desk,,U_F090
F091,found,raincoat,clothing,blue,,Found blue raincoat outside Memorial Library; turned into front desk pickup.,Memorial Library,2026-05-03,department office,,U_F091
F092,found,stylus,electronics,dark,Apple,Picked up a dark stylus around SERF. Message with details to confirm.,SERF,2026-04-15,department office,,U_F092
F093,found,makeup pouch,miscellaneous,dark,,Someone left a makeup pouch at Business School. Looks dark. a worn label.,Business School,2026-05-29,front desk pickup,,U_F093
F094,found,travel mug,bottle,white,Yeti,Found a white travel mug near State Street. Left it with library circulation desk.,State Street,2026-03-11,email,,U_F094
F095,found,book,books_notes,red,,Found red book outside Bakke Recreation Center; turned into security desk.,Bakke Recreation Center,2026-06-06,email,,U_F095
F096,found,earbuds,electronics,dark,Samsung,Found dark earbuds outside Wisconsin Union Theater; turned into residence hall desk.,Wisconsin Union Theater,2026-04-27,department office,,U_F096
F097,found,glove,clothing,grey,,Found a grey glove near Union South. Left it with front desk pickup.,Union South,2026-04-21,residence hall desk,,U_F097
F098,found,portable charger,electronics,white,Anker,Someone left a portable charger at Grainger Hall. Looks white. a worn label.,Grainger Hall,2026-04-17,security desk,,U_F098
F099,found,shoulder bag,bags,dark,,There is a dark shoulder bag at State Street. I can meet or leave it at the desk.,State Street,2026-06-04,library circulation desk,,U_F099
F100,found,notebook,books_notes,orange,,Someone left a notebook at SERF. Looks orange. a small dent.,SERF,2026-04-04,front desk pickup,,U_F100
F101,found,wallet,wallets_cards,dark blue,,Picked up a dark blue wallet around Business School. Message with details to confirm.,Business School,2026-04-10,campus app message,,U_F101
F102,found,keys,keys,gold,,There is a gold keys at Bakke Recreation Center. I can meet or leave it at the desk.,Bakke Recreation Center,2026-03-25,email,,U_F102
F103,found,cap,clothing,red,Nike,Found red cap outside Bakke Recreation Center; turned into front desk pickup.,Bakke Recreation Center,2026-06-06,library circulation desk,,U_F103
F104,found,water bottle,bottle,silver,ThermoFlask,Someone left a water bottle at Kohl Center. Looks silver. a keychain attached.,Kohl Center,2026-04-07,email,,U_F104
F105,found,laptop sleeve,bags,dark,,Picked up a dark laptop sleeve around Dejope Residence Hall. Message with details to confirm.,Dejope Residence Hall,2026-05-30,library circulation desk,,U_F105
F106,found,book,books_notes,blue,,Someone left a book at Computer Sciences Building. Looks blue. a sticker on it.,Computer Sciences Building,2026-05-10,front desk pickup,,U_F106
F107,found,charger,electronics,white,Apple,Picked up a white charger around Wisconsin Union Theater. Message with details to confirm.,Wisconsin Union Theater,2026-03-14,department office,,U_F107
F108,found,umbrella,umbrellas,dark,Totes,There is a dark umbrella at Union South. I can meet or leave it at the desk.,Union South,2026-05-01,security desk,,U_F108
F109,found,ring,jewelry_accessories,silver,,Picked up a silver ring around SERF. Message with details to confirm.,SERF,2026-05-01,campus app message,,U_F109
F110,found,ID card,wallets_cards,red,Wiscard,Found red ID card outside College Library; turned into security desk.,College Library,2026-05-13,residence hall desk,,U_F110
F111,found,backpack,bags,grey,Adidas,Found a grey backpack near Memorial Library. Left it with email.,Memorial Library,2026-06-12,library circulation desk,,U_F111
F112,found,notebook,books_notes,dark,,Found a dark notebook near Nicholas Recreation Center. Left it with email.,Nicholas Recreation Center,2026-05-11,department office,,U_F112
F113,found,headphones,electronics,white,Sony,There is a white headphones at Witte Residence Hall. I can meet or leave it at the desk.,Witte Residence Hall,2026-03-29,department office,,U_F113
F114,found,scarf,clothing,grey,,Found grey scarf outside Chazen Museum; turned into security desk.,Chazen Museum,2026-04-08,department office,,U_F114
F115,found,pouch,miscellaneous,purple,,Found purple pouch outside Camp Randall; turned into front desk pickup.,Camp Randall,2026-05-19,campus app message,,U_F115
F116,found,glasses case,miscellaneous,dark,,Found a dark glasses case near Kohl Center. Left it with department office.,Kohl Center,2026-05-20,email,,U_F116
F117,found,bottle,bottle,transparent,Owala,Found a transparent bottle near Business School. Left it with email.,Business School,2026-03-23,library circulation desk,,U_F117
F118,found,calculator,electronics,dark,Casio,Picked up a dark calculator around College Library. Message with details to confirm.,College Library,2026-04-27,residence hall desk,,U_F118
F119,found,sweatshirt,clothing,green,,Found green sweatshirt outside Kohl Center; turned into front desk pickup.,Kohl Center,2026-03-30,front desk pickup,,U_F119
F120,found,lunch bag,miscellaneous,blue,,Someone left a lunch bag at Wisconsin Union Theater. Looks blue. a small dent.,Wisconsin Union Theater,2026-03-10,residence hall desk,,U_F120
